{
  "schema_version": "etf-holdings-catalog.v1",
  "release_id": "etf-holdings-2026q2-d095295436a2",
  "manifest_hash": "d095295436a292af3cbc793eacb5ef807d73ed4c37ad9f25abf807b97e15ec7d",
  "source_record_hash": "cefae19fdfbd72b94695a96d6c8aaedc88e027c86ab3702856658b8c2425cc31",
  "flow_release_id": "etf-flows-2026-03-31-5666b40693b4",
  "flow_manifest_hash": "5666b40693b41328e3053753284f992fb09f97ba2359e63e7d7a807dc72fca30",
  "security_metadata_hash": "abbc577dc140b203eadd043dd15459c491caada1b0b00d5c13f06706a61a5afc",
  "dataset_period": "2026Q2",
  "dataset_url": "https://www.sec.gov/files/dera/data/form-n-port-data-sets/2026q2_nport.zip",
  "dataset_sha256": "077cc836a978a593b29012219395fbe9c303d5e930f5be3b5f4353c3b02296fc",
  "dataset_published_at": "2026-07-09T15:11:37Z",
  "retrieved_at": "2026-08-14T00:47:41Z",
  "observed_at": "2026-03-31T00:00:00Z",
  "fresh_until": "2026-10-17T15:11:37Z",
  "selection_rule": "top_10_by_filed_percentage_desc",
  "scope": "Top ten filed positions by reported percentage for VGT, QQQ, and SMH from the SEC 2026Q2 Form N-PORT dataset.",
  "methodology": "For each fund, Quantify publishes the ten reviewed FUND_REPORTED_HOLDING rows with the largest exact filed percentage, in descending order. Display tickers and themes are joined only by exact CUSIP from the versioned reviewed security map.",
  "limitations": [
    "This is a delayed top-ten filing snapshot, not a complete or live portfolio.",
    "Filed percentage and currency value are preserved from Form N-PORT and are not current market exposures.",
    "A mapped ticker connects only the exact reviewed security row; missing ticker mappings remain null.",
    "The release does not infer sector allocation, flow attribution, investor intent, market direction, or a recommendation."
  ],
  "funds": [
    {
      "fund_id": "sec-series:S000101292",
      "ticker": "QQQ",
      "slug": "qqq",
      "name": "Invesco QQQ Trust, Series 1",
      "accession": "0001067839-26-000024",
      "filed_date": "2026-05-28",
      "report_date": "2026-03-31",
      "net_assets_usd": 372507306132.08,
      "total_holding_rows": 102,
      "published_holding_rows": 10,
      "top_ten_concentration_pct": 46.847763232156,
      "holdings": [
        {
          "rank": 1,
          "holding_id": "170260697",
          "issuer_name": "NVIDIA Corp.",
          "issuer_title": "NVIDIA Corp.",
          "cusip": "67066G104",
          "ticker": "NVDA",
          "theme": "AI & Semiconductors",
          "balance": 185426246.0,
          "unit": "NS",
          "currency_code": "USD",
          "currency_value": 32338337302.4,
          "filed_percentage": 8.681262560507,
          "investment_country": "US"
        },
        {
          "rank": 2,
          "holding_id": "170260741",
          "issuer_name": "Apple Inc.",
          "issuer_title": "Apple Inc.",
          "cusip": "037833100",
          "ticker": "AAPL",
          "theme": "Consumer",
          "balance": 112027518.0,
          "unit": "NS",
          "currency_code": "USD",
          "currency_value": 28431463793.22,
          "filed_percentage": 7.63245802839,
          "investment_country": "US"
        },
        {
          "rank": 3,
          "holding_id": "170260754",
          "issuer_name": "Microsoft Corp.",
          "issuer_title": "Microsoft Corp.",
          "cusip": "594918104",
          "ticker": "MSFT",
          "theme": "Cloud & Software",
          "balance": 56662808.0,
          "unit": "NS",
          "currency_code": "USD",
          "currency_value": 20974871637.36,
          "filed_percentage": 5.630727583614,
          "investment_country": "US"
        },
        {
          "rank": 4,
          "holding_id": "170260649",
          "issuer_name": "Amazon.com, Inc.",
          "issuer_title": "Amazon.com, Inc.",
          "cusip": "023135106",
          "ticker": "AMZN",
          "theme": "Internet Platforms",
          "balance": 81915069.0,
          "unit": "NS",
          "currency_code": "USD",
          "currency_value": 17060451420.63,
          "filed_percentage": 4.579897129475,
          "investment_country": "US"
        },
        {
          "rank": 5,
          "holding_id": "170260629",
          "issuer_name": "Tesla, Inc.",
          "issuer_title": "Tesla, Inc.",
          "cusip": "88160R101",
          "ticker": "TSLA",
          "theme": "Consumer",
          "balance": 38085568.0,
          "unit": "NS",
          "currency_code": "USD",
          "currency_value": 14158309904.0,
          "filed_percentage": 3.800814016512,
          "investment_country": "US"
        },
        {
          "rank": 6,
          "holding_id": "170260714",
          "issuer_name": "Meta Platforms, Inc.",
          "issuer_title": "Meta Platforms, Inc., Class A",
          "cusip": "30303M102",
          "ticker": "META",
          "theme": "Internet Platforms",
          "balance": 22505761.0,
          "unit": "NS",
          "currency_code": "USD",
          "currency_value": 12876221040.93,
          "filed_percentage": 3.456635837463,
          "investment_country": "US"
        },
        {
          "rank": 7,
          "holding_id": "170260694",
          "issuer_name": "Walmart Inc.",
          "issuer_title": "Walmart Inc.",
          "cusip": "931142103",
          "ticker": null,
          "theme": null,
          "balance": 102954591.0,
          "unit": "NS",
          "currency_code": "USD",
          "currency_value": 12795196569.48,
          "filed_percentage": 3.434884728124,
          "investment_country": "US"
        },
        {
          "rank": 8,
          "holding_id": "170260647",
          "issuer_name": "Alphabet Inc.",
          "issuer_title": "Alphabet Inc., Class A",
          "cusip": "02079K305",
          "ticker": "GOOGL",
          "theme": "Internet Platforms",
          "balance": 44426017.0,
          "unit": "NS",
          "currency_code": "USD",
          "currency_value": 12775145448.52,
          "filed_percentage": 3.429501982436,
          "investment_country": "US"
        },
        {
          "rank": 9,
          "holding_id": "170260692",
          "issuer_name": "Alphabet Inc.",
          "issuer_title": "Alphabet Inc., Class C",
          "cusip": "02079K107",
          "ticker": "GOOG",
          "theme": "Internet Platforms",
          "balance": 41495816.0,
          "unit": "NS",
          "currency_code": "USD",
          "currency_value": 11903489777.76,
          "filed_percentage": 3.195505049648,
          "investment_country": "US"
        },
        {
          "rank": 10,
          "holding_id": "170260669",
          "issuer_name": "Broadcom Inc.",
          "issuer_title": "Broadcom Inc.",
          "cusip": "11135F101",
          "ticker": "AVGO",
          "theme": "AI & Semiconductors",
          "balance": 36179296.0,
          "unit": "NS",
          "currency_code": "USD",
          "currency_value": 11197853904.96,
          "filed_percentage": 3.006076315987,
          "investment_country": "US"
        }
      ],
      "source_url": "https://www.sec.gov/Archives/edgar/data/1067839/000106783926000024/0001067839-26-000024-index.html"
    },
    {
      "fund_id": "sec-series:S000034411",
      "ticker": "SMH",
      "slug": "smh",
      "name": "VanEck Semiconductor ETF",
      "accession": "0001410368-26-054882",
      "filed_date": "2026-05-28",
      "report_date": "2026-03-31",
      "net_assets_usd": 40983896027.1,
      "total_holding_rows": 26,
      "published_holding_rows": 10,
      "top_ten_concentration_pct": 72.189334899571,
      "holdings": [
        {
          "rank": 1,
          "holding_id": "170544363",
          "issuer_name": "NVIDIA Corp",
          "issuer_title": "NVIDIA Corp",
          "cusip": "67066G104",
          "ticker": "NVDA",
          "theme": "AI & Semiconductors",
          "balance": 46163721.0,
          "unit": "NS",
          "currency_code": "USD",
          "currency_value": 8050952942.4,
          "filed_percentage": 19.64418643136,
          "investment_country": "US"
        },
        {
          "rank": 2,
          "holding_id": "170544383",
          "issuer_name": "Taiwan Semiconductor Manufacturing Co Ltd",
          "issuer_title": "Taiwan Semiconductor Manufacturing Co Ltd",
          "cusip": "874039100",
          "ticker": "TSM",
          "theme": "AI & Semiconductors",
          "balance": 14359741.0,
          "unit": "NS",
          "currency_code": "USD",
          "currency_value": 4852874470.95,
          "filed_percentage": 11.8409300759,
          "investment_country": "TW"
        },
        {
          "rank": 3,
          "holding_id": "170544336",
          "issuer_name": "Broadcom Inc",
          "issuer_title": "Broadcom Inc",
          "cusip": "11135F101",
          "ticker": "AVGO",
          "theme": "AI & Semiconductors",
          "balance": 10321660.0,
          "unit": "NS",
          "currency_code": "USD",
          "currency_value": 3194656986.6,
          "filed_percentage": 7.794907991391,
          "investment_country": "US"
        },
        {
          "rank": 4,
          "holding_id": "170544395",
          "issuer_name": "ASML Holding NV",
          "issuer_title": "ASML Holding NV",
          "cusip": "000000000",
          "ticker": null,
          "theme": null,
          "balance": 1548300.0,
          "unit": "NS",
          "currency_code": "USD",
          "currency_value": 2045041089.0,
          "filed_percentage": 4.989865013437,
          "investment_country": "NL"
        },
        {
          "rank": 5,
          "holding_id": "170544345",
          "issuer_name": "KLA Corp",
          "issuer_title": "KLA Corp",
          "cusip": "482480100",
          "ticker": null,
          "theme": null,
          "balance": 1318928.0,
          "unit": "NS",
          "currency_code": "USD",
          "currency_value": 1942002776.48,